{
  "protocol": "dev.jazz.live-otlp-projection",
  "protocolVersion": 1,
  "archiveFixture": "02-labeled-narration",
  "archiveId": "ar-22222222-2222-7222-8222-222222222222",
  "originId": "origin-22222222-2222-7222-8222-222222222222",
  "captureId": "cap-22222222-2222-7222-8222-222222222222",
  "items": [
    {
      "kind": "observation",
      "itemId": "obs-22222222-2222-7222-8222-222222222220",
      "canonicalDigest": "bcfe735942d14c0d98b6acfe82fe8d3db8a4109a12a35fda49b69c8901cd92e8",
      "canonicalJcs": "{\"actorRefs\":[{\"actorId\":\"actor-22222222-2222-7222-8222-222222222222\",\"basis\":\"declared\",\"method\":\"session_recorder\",\"role\":\"performer\"}],\"artifactRefs\":[],\"captureId\":\"cap-22222222-2222-7222-8222-222222222222\",\"capturedAt\":\"2026-07-22T09:00:00Z\",\"labelRefs\":[],\"legacyCorrelation\":{\"eventId\":\"s-22222222-2222-7222-8222-222222222222-0\",\"sequence\":0,\"sessionId\":\"s-22222222-2222-7222-8222-222222222222\"},\"monotonicTime\":{\"bootId\":\"boot-fixture-02\",\"clockDomainId\":\"clock-fixture-02-controller\",\"clockId\":\"mach_continuous_time\",\"ticks\":\"1000000000\",\"unit\":\"nanosecond\"},\"observationId\":\"obs-22222222-2222-7222-8222-222222222220\",\"occurredAt\":\"2026-07-22T09:00:00Z\",\"originId\":\"origin-22222222-2222-7222-8222-222222222222\",\"payload\":{\"eventId\":\"s-22222222-2222-7222-8222-222222222222-0\",\"eventType\":\"session_start\",\"sequence\":0,\"sessionId\":\"s-22222222-2222-7222-8222-222222222222\",\"timestamp\":\"2026-07-22T09:00:00Z\",\"url\":\"app://session\"},\"payloadSchema\":\"https://jasnost.dev/schema/activity-event.schema.json\",\"privacy\":{\"policyVersion\":\"consent-v1\",\"redactions\":[],\"status\":\"captured\"},\"provenance\":{\"factClass\":\"observed\",\"sources\":[\"src-22000000-0000-7000-8000-000000000001\"]},\"quality\":{\"reasons\":[],\"status\":\"complete\"},\"recordType\":\"jazz.activity-event\",\"schemaVersion\":1,\"sourceRefs\":[{\"role\":\"trigger\",\"sourceId\":\"src-22000000-0000-7000-8000-000000000001\"}],\"streamId\":\"stream-22222222-2222-7222-8222-222222222222\",\"streamSequence\":0}",
      "capturedAt": "2026-07-22T09:00:00Z",
      "streamId": "stream-22222222-2222-7222-8222-222222222222",
      "streamSequence": 0,
      "recordType": "jazz.activity-event"
    },
    {
      "kind": "observation",
      "itemId": "obs-22222222-2222-7222-8222-222222222221",
      "canonicalDigest": "26ba7b53a33bf3ef92f1eef30cf458bf1c62c7277b4e64f273243c5704b6d2d2",
      "canonicalJcs": "{\"actorRefs\":[{\"actorId\":\"actor-22222222-2222-7222-8222-222222222222\",\"basis\":\"declared\",\"method\":\"session_recorder\",\"role\":\"narrator\"}],\"artifactRefs\":[],\"captureId\":\"cap-22222222-2222-7222-8222-222222222222\",\"capturedAt\":\"2026-07-22T09:00:10Z\",\"labelRefs\":[\"l-22222222-2222-7222-8222-222222222222\"],\"legacyCorrelation\":{\"eventId\":\"s-22222222-2222-7222-8222-222222222222-1\",\"sequence\":1,\"sessionId\":\"s-22222222-2222-7222-8222-222222222222\"},\"monotonicTime\":{\"bootId\":\"boot-fixture-02\",\"clockDomainId\":\"clock-fixture-02-controller\",\"clockId\":\"mach_continuous_time\",\"ticks\":\"11000000000\",\"unit\":\"nanosecond\"},\"observationId\":\"obs-22222222-2222-7222-8222-222222222221\",\"occurredAt\":\"2026-07-22T09:00:10Z\",\"originId\":\"origin-22222222-2222-7222-8222-222222222222\",\"payload\":{\"eventId\":\"s-22222222-2222-7222-8222-222222222222-1\",\"eventType\":\"label_start\",\"label\":\"Monthly booking\",\"labelId\":\"l-22222222-2222-7222-8222-222222222222\",\"process\":\"Monthly booking\",\"processId\":\"monthly-booking\",\"sequence\":1,\"sessionId\":\"s-22222222-2222-7222-8222-222222222222\",\"timestamp\":\"2026-07-22T09:00:10Z\",\"url\":\"app://session\"},\"payloadSchema\":\"https://jasnost.dev/schema/activity-event.schema.json\",\"privacy\":{\"policyVersion\":\"consent-v1\",\"redactions\":[],\"status\":\"captured\"},\"provenance\":{\"factClass\":\"declared\",\"sources\":[\"src-22000000-0000-7000-8000-000000000001\"]},\"quality\":{\"reasons\":[],\"status\":\"complete\"},\"recordType\":\"jazz.activity-event\",\"schemaVersion\":1,\"sourceRefs\":[{\"role\":\"trigger\",\"sourceId\":\"src-22000000-0000-7000-8000-000000000001\"}],\"streamId\":\"stream-22222222-2222-7222-8222-222222222222\",\"streamSequence\":1}",
      "capturedAt": "2026-07-22T09:00:10Z",
      "streamId": "stream-22222222-2222-7222-8222-222222222222",
      "streamSequence": 1,
      "recordType": "jazz.activity-event"
    },
    {
      "kind": "observation",
      "itemId": "obs-22222222-2222-7222-8222-222222222222",
      "canonicalDigest": "346dc6044b003e211bc3f97174964c6d6acc790c7418078673a404b15bf0a12c",
      "canonicalJcs": "{\"actorRefs\":[{\"actorId\":\"actor-22222222-2222-7222-8222-222222222222\",\"basis\":\"declared\",\"method\":\"session_recorder\",\"role\":\"performer\"}],\"artifactRefs\":[],\"captureId\":\"cap-22222222-2222-7222-8222-222222222222\",\"capturedAt\":\"2026-07-22T09:00:20.050Z\",\"contextRefs\":{\"conversation\":{\"namespace\":\"jazz.conversation\",\"value\":\"fixture-conversation-02\"},\"engagement\":{\"namespace\":\"jazz.engagement\",\"value\":\"fixture-engagement-02\"}},\"enrichedAt\":\"2026-07-22T09:00:20.050Z\",\"interactionContext\":{\"action\":{\"gestureId\":\"gesture-fixture-1\",\"modifiers\":[],\"type\":\"click\"},\"application\":{\"identity\":{\"namespace\":\"macos.bundle-id\",\"value\":\"com.example.finance\"},\"name\":\"Finance App\",\"version\":\"7.2\"},\"quality\":{\"confidence\":0.98,\"reasons\":[],\"status\":\"complete\"},\"target\":{\"capabilities\":[\"invoke\",\"focus\"],\"geometry\":{\"coordinateSpace\":\"screen_points\",\"displayId\":\"main\",\"height\":32,\"scaleFactor\":2,\"width\":100,\"x\":120,\"y\":240},\"locatorCandidates\":[{\"kind\":\"identifier\",\"namespace\":\"macos.ax\",\"scope\":\"application\",\"stability\":\"stable\",\"value\":\"book-order-button\"},{\"kind\":\"role-name\",\"namespace\":\"macos.ax\",\"scope\":\"window\",\"stability\":\"session\",\"value\":\"AXButton|Book order\"}],\"name\":\"Book order\",\"role\":\"button\"},\"window\":{\"identity\":{\"namespace\":\"macos.window-id\",\"value\":\"42\"},\"title\":\"Orders\"}},\"labelRefs\":[\"l-22222222-2222-7222-8222-222222222222\"],\"legacyCorrelation\":{\"eventId\":\"s-22222222-2222-7222-8222-222222222222-2\",\"sequence\":2,\"sessionId\":\"s-22222222-2222-7222-8222-222222222222\"},\"monotonicTime\":{\"bootId\":\"boot-fixture-02\",\"clockDomainId\":\"clock-fixture-02-cg\",\"clockId\":\"cg_event_timestamp\",\"ticks\":\"21000000000\",\"unit\":\"nanosecond\"},\"observationId\":\"obs-22222222-2222-7222-8222-222222222222\",\"occurredAt\":\"2026-07-22T09:00:20Z\",\"originId\":\"origin-22222222-2222-7222-8222-222222222222\",\"payload\":{\"eventId\":\"s-22222222-2222-7222-8222-222222222222-2\",\"eventType\":\"click\",\"label\":\"Monthly booking\",\"labelId\":\"l-22222222-2222-7222-8222-222222222222\",\"pageTitle\":\"Orders\",\"process\":\"Monthly booking\",\"processId\":\"monthly-booking\",\"sequence\":2,\"sessionId\":\"s-22222222-2222-7222-8222-222222222222\",\"system\":\"Finance App\",\"target\":{\"accessibleName\":\"Book order\",\"role\":\"AXButton\"},\"timestamp\":\"2026-07-22T09:00:20.050Z\",\"url\":\"app://com.example.finance\"},\"payloadSchema\":\"https://jasnost.dev/schema/activity-event.schema.json\",\"privacy\":{\"policyVersion\":\"consent-v1\",\"redactions\":[],\"status\":\"captured\"},\"provenance\":{\"factClass\":\"observed\",\"sources\":[\"src-22000000-0000-7000-8000-000000000002\",\"src-22000000-0000-7000-8000-000000000003\"]},\"quality\":{\"reasons\":[],\"status\":\"complete\",\"timingErrorMillis\":50},\"recordType\":\"jazz.activity-event\",\"schemaVersion\":1,\"sourceRefs\":[{\"role\":\"trigger\",\"sourceId\":\"src-22000000-0000-7000-8000-000000000002\"},{\"role\":\"target_enrichment\",\"sourceId\":\"src-22000000-0000-7000-8000-000000000003\"}],\"streamId\":\"stream-22222222-2222-7222-8222-222222222222\",\"streamSequence\":2}",
      "capturedAt": "2026-07-22T09:00:20.050Z",
      "streamId": "stream-22222222-2222-7222-8222-222222222222",
      "streamSequence": 2,
      "recordType": "jazz.activity-event"
    },
    {
      "kind": "observation",
      "itemId": "obs-22222222-2222-7222-8222-222222222223",
      "canonicalDigest": "0bd1dbc199b7bf3944eb6bc36e768b3b681e8e604bc868800dc381ce0cbbc76b",